,eid,doi,pii,pubmed_id,title,subtype,subtypeDescription,creator,afid,affilname,affiliation_city,affiliation_country,author_count,author_names,author_ids,author_afids,coverDate,coverDisplayDate,publicationName,issn,source_id,eIssn,aggregationType,volume,issueIdentifier,article_number,pageRange,description,authkeywords,citedby_count,openaccess,freetoread,freetoreadLabel,fund_acr,fund_no,fund_sponsor
56,2-s2.0-85049610073,10.1016/j.apm.2018.06.037,S0307904X18302907,,"A tool for time, variance and energy related performance estimations in a shuttle-based storage and retrieval system",ar,Article,Ekren B.,60068756;60028947;60004060,Université Abou Bekr Belkaid Tlemcen;Yaşar Universitesi;Univerza v Mariboru,Tlemcen;Izmir;Maribor,Algeria;Turkey;Slovenia,4,"Ekren, Banu Y.;Akpunar, Anıl;Sari, Zaki;Lerher, Tone",23488489800;57193876456;22954822200;56055552400,60028947;60028947;60068756;60004060,2018-11-01,November 2018,Applied Mathematical Modelling,0307904X,28065,,Journal,63,,,109-127,"The aim of this study is to present a tool that can calculate critical performance measures of different Shuttle-Based Storage and Retrieval System (SBS/RS) designs. Specifically, our aim is to develop an analytical model-based tool that can estimate the mean and variance of travel time of lifts and shuttles, as well as the mean amount of energy consumption and energy regeneration per transaction for a pre-defined SBS/RS design. The methodology illustrated in this paper can also be utilized for any system having a straight discrete travel pattern with equal distance stop points. We are motivated in this study by a relatively new automated storage and retrieval technology, SBS/RS. By the provided tool, one can evaluate these systems’ performance promptly by changing the input design parameters (e.g., discrete travel lengths, velocity of vehicles, acceleration/deceleration of vehicles, number of tiers, number of bays, etc.) of these systems. The analytical models used in the tool are verified via simulation for several SBS/RS design scenarios. As a result, it is found that the proposed tool produces highly accurate results, specifically less than 1% Absolute Percentage Error from the simulation results.",Automated storage and retrieval system | Mean travel time | SBS/RS | Shuttle-based storage and retrieval system | Variance of travel time,54,1,publisherfree2read,Bronze,ARRS,214M613,Javna Agencija za Raziskovalno Dejavnost RS
57,2-s2.0-85027333741,10.1080/00207543.2017.1361049,,,Travel-time model of dual-command cycles in a 3D compact AS/RS with lower mid-point I/O dwell point policy,ar,Article,Xu X.,60108959;60025761;60024979;117624595,EMLYON Business School;Huazhong University of Science and Technology;Zhongnan University of Economics and Law;Deppon Logistics Corporation,Ecully;Wuhan;Wuhan;Shanghai,France;China;China;China,5,"Xu, Xianhao;Gong, Yeming (Yale);Fan, Xiangxiang;Shen, Guwen;Zou, Bipan",55669169800;24767308200;57195349545;56194450200;56924489500,60025761;60108959;60025761;60025761-117624595;60025761-60024979,2018-02-16,16 February 2018,International Journal of Production Research,00207543,27656,1366588X,Journal,56,4,,1620-1641,"Three-dimensional compact automated storage/retrieval systems (AS/RS) have been extensively applied in warehouses, with advantages of full automation, time efficiency and high space utilisation. While previous studies that use lower mid-point input/output (I/O) dwell point policy consider single-command cycles (SC), this paper builds travel-time models of dual-command cycles (DC). The S/R crane also dwells in the lower mid-point of the rack when it is idle. We validate analytical models using simulation and use analytical models to optimise system dimensions. Numerical experiments are used to compare DC with SC. The results show that DC outperform SC in terms of cycle time of one command.",3D compact AS/RS | I/O dwell point policy | storage rack dimensions optimisation | travel-time analysis | warehousing,29,0,,,NSFC,71131004,National Natural Science Foundation of China
58,2-s2.0-85031817479,10.1109/TKDE.2017.2760880,,,An Efficient Ride-Sharing Framework for Maximizing Shared Route,ar,Article,Ta N.,60025278;60022317;60018208;60014402,Tsinghua University;University of Macau;Washington State University Pullman;Renmin University of China,Beijing;Taipa;Pullman;Beijing,China;Macao;United States;China,6,"Ta, Na;Li, Guoliang;Zhao, Tianyu;Feng, Jianhua;Ma, Hanchao;Gong, Zhiguo",56371256600;55800543300;57196086207;7403884576;57222725163;7201949170,60014402;60025278;60025278;60025278;60018208;60022317,2018-02-01,1 February 2018,IEEE Transactions on Knowledge and Data Engineering,10414347,17362,,Journal,30,2,8062833,219-233,"Ride-sharing (RS) has great values in saving energy and alleviating traffic pressure. Existing studies can be improved for better efficiency. Therefore, we propose a new ride-sharing model, where each driver has a requirement that if the driver shares a ride with a rider, the shared route percentage (i.e., the ratio of the shared route's distance to the driver's total travel distance) exceeds an expectation rate of the driver, e.g., 0.8. We consider two variants of this problem. The first considers multiple drivers and multiple riders and aims to compute driver-rider pairs to maximize the overall shared route percentage (SRP). We model this problem as the maximum weighted bigraph matching problem, where the vertices are drivers and riders, edges are driver-rider pairs, and edge weights are driver-rider's SRP. However, it is rather expensive to compute the SRP values for large numbers of driver-rider pairs on road networks. To address this problem, we propose an efficient method to prune many unnecessary driver-rider pairs and avoid computing the SRP values for every pair. To improve the efficiency, we propose an approximate method with error bound guarantee. The basic idea is that we compute an upper bound and a lower bound for each driver-rider pair in constant time. Then, we estimate an upper bound and a lower bound of the graph matching. Next, we select some driver-rider pairs, compute their real shortest-route distance, and update the lower and upper bounds of the maximum graph matching. We repeat above steps until the ratio of the upper bound to the lower bound is not larger than a given approximate rate. The second considers multiple drivers and a single rider and aims to find the top- k drivers for the rider with the largest SRP. We first prune a large number of drivers that cannot meet the SRP requirements. Then, we propose a best-first algorithm that progressively selects the drivers with high probability to be in the top- k results and prunes the drivers that cannot be in the top- k results. Extensive experiments on real-world datasets demonstrate the superiority of our method.",bigraph matching | join-based sharing | Ride-sharing | search-based sharing | shared route percentage,71,0,,,NSF,2015CB358700,National Science Foundation
60,2-s2.0-85030992109,10.3791/56211,,29053684,Remotely supervised transcranial direct current stimulation: An update on safety and tolerability,ar,Article,Shaw M.T.,60141798;60032105;60028458;113093182,Stony Brook Medicine;NYU Langone Health;City College of New York;Soterix Medical,Stony Brook;New York;New York;New York,United States;United States;United States;United States,9,"Shaw, Michael T.;Kasschau, Margaret;Dobbs, Bryan;Pawlak, Natalie;Pau, William;Sherman, Kathleen;Bikson, Marom;Datta, Abhishek;Charvet, Leigh E.",57033468300;56600400900;57193402697;57191157953;57192952738;57213913492;6602932724;35774230000;55537283900,60032105;60141798;60032105;60032105;60032105;60032105;60028458;113093182;60032105,2017-10-07,7 October 2017,Journal of Visualized Experiments,1940087X,19900191993,,Journal,2017,128,e56211,,"The remotely supervised tDCS (RS-tDCS) protocol enables participation from home through guided and monitored self-administration of tDCS treatment while maintaining clinical standards. The current consensus regarding the efficacy of tDCS is that multiple treatment sessions are needed to observe targeted behavioral reductions in symptom burden. However, the requirement for patients to travel to clinic daily for stimulation sessions presents a major obstacle for potential participants, due to work or family obligations or limited ability to travel. This study presents a protocol that directly overcomes these obstacles by eliminating the need to travel to clinic for daily sessions. This is an updated protocol for remotely supervised self-administration of tDCS for daily treatment sessions paired with a program of computerbased cognitive training for use in clinical trials. Participants only need to attend clinic twice, for a baseline and study-end visit. At baseline, participants are trained and provided with a study stimulation device, and a small laptop computer. Participants then complete the remainder of their stimulation sessions at home while they are monitored via videoconferencing software. Participants complete computerized cognitive remediation during stimulation sessions, which may serve a therapeutic role or as a ""placeholder"" for other computer-based activity. Computers are enabled for real-time monitoring and remote control by study staff. Outcome measures that assess feasibility and tolerance are administered remotely with the aid of visual analogue scales that are presented onscreen. Following completion of all RS-tDCS sessions, participants return to clinic for a study end visit in which all study equipment is returned. Results support the safety, feasibility, and scalability of the RS-tDCS protocol for use in clinical trials. Across 46 patients, 748 RS-tDCS sessions have been completed. This protocol serves as a model for use in future clinical trials involving tDCS.",Cognition | Issue 128 | Multiple sclerosis | Neuromodulation | Neuroscience | Parkinson's disease | Remotely supervised | RS-tDCS | Tdcs | Telemedicine | Telerehabilitation,39,1,repositoryam,Green,,undefined,
61,2-s2.0-85020732641,10.1016/j.tre.2017.05.010,S1366554516305543,,Designing the optimal multi-deep AS/RS storage rack under full turnover-based storage policy based on non-approximate speed model of S/R machine,ar,Article,Yang P.,60025278,Tsinghua University,Beijing,China,5,"Yang, Peng;Yang, Kaidong;Qi, Mingyao;Miao, Lixin;Ye, Bin",55831984900;57193416623;23111610800;7005303290;55632139500,60025278;60025278;60025278;60025278;60025278,2017-08-01,August 2017,Transportation Research Part E: Logistics and Transportation Review,13665545,20909,,Journal,104,,,113-130,"The design of an optimal rack for 3D multi-deep AS/RS under full turnover-based storage policy is explored in this paper. The acceleration and deceleration characteristics of storage and retrieval (S/R) machine are considered based on non-approximate speed model of S/R machine. We divided three typical scenarios to investigate. With regards to each scenario, we derive the expected retrieval time for single-command cycles adopting exact speed model and develop the model for optimally designing 3D multi-deep AS/RS rack. From the model, we can derive the optimal rack dimensions for various scenarios more precisely. Our findings are demonstrated by a practical example.",Acceleration/deceleration | Multi-deep AS/RS | Storage rack design | Travel time model | Turnover-based storage,25,0,,,NSFC,JCYJ20150331151358130,National Natural Science Foundation of China
62,2-s2.0-85028061732,10.1109/CCDC.2017.7979095,,,Travel time analysis of the single and dual command of AS/RS,cp,Conference Paper,Shi H.Y.,60264287;60084619,Yingkou Institute of Technology;University of Science and Technology Liaoning,Yingkou;Anshan,China;China,3,"Shi, Hong Yuan;Lu, Xin;Li, Da Wei",57195425939;57195433305;23110379800,60264287;60264287;60084619,2017-07-12,12 July 2017,"Proceedings of the 29th Chinese Control and Decision Conference, CCDC 2017",,21100827989,,Conference Proceeding,,,7979095,3407-3413,"Multi aisle automated storage and retrieval systems correspond to multiple picking aisles served by a single storage and retrieval machine. We use this system for saving the initial investment costs due to single aisle systems. The objective of the presented study is to develop analytical travel time models for multi aisle automated storage and retrieval systems considering the operating characteristics of the storage and retrieval machine. Acceleration and deceleration of the storage and retrieval machine is considered in this paper instead of uniform speed, and there are curve channels in the warehouse. Based on the above hypothesis, the time function and distance function are studied in this paper. The distribution function of the distance and time is given. On this basis, the expected travel time of the automated storage and retrieval system is studied. Finally, a numerical example is given. The results show that proposed analytical travel time models perform satisfactory according to the results and could be very useful tools for designing of multi aisle automated storage and retrieval systems in real-world applications.",AS/RS | Dual command | Logistics system | Single command | Travel time,7,0,,,,undefined,
63,2-s2.0-85050406616,10.1109/EDIS.2017.8284042,,,Optimization of free-fall-flow-rack automated storage and retrieval system dimensions,cp,Conference Paper,Metahri D.,60211353,Université d'Oran 2,Oran,Algeria,2,"Metahri, Dhiyaeddine;Hachemi, Khalid",57195150791;36170559800,60211353;60211353,2017-07-02,2 July 2017,Proceedings of EDIS 2017 - 1st International Conference on Embedded and Distributed Systems,,21101180191,,Conference Proceeding,2017-December,,,1-6,"The automated storage and retrieval systems (AS/RSs) consist of automated material handling solutions for warehouses based on a computer-controlled system. The AS/RS offers a better alternative to manual storage/retrieval of items. It is important to know that the design of an AS/RS is crucial to increase the system performance. For this, this paper deals with optimizing the dimensions of the free-fall-flow rack AS/RS (FF-flow-rack AS/RS). These optimal dimensions are evaluated according to the minimum retrieval travel time. In the first part, we present the FF-flow-rack AS/RS then, we develop its discrete model that estimates the average retrieval-travel-time. Subsequently, an optimization algorithm has been developed and used for several rack capacity. The proposed method allows to find the optimal dimensions of the rack with a reasonable computing time.",Automated storage and retrieval systems (AS/RSs) | Discrete Optimization | Free-Fall-Flow Rack AS/RS (FF-flow-rack AS/RS) | Retrieval travel time,1,0,,,,undefined,
64,2-s2.0-85014091593,10.1016/j.cor.2017.02.012,S0305054817300503,,A multi-tier linking approach to analyze performance of autonomous vehicle-based storage and retrieval systems,ar,Article,Roy D.,60160059;60033308;60032179;60025534,"College of Engineering, Architecture and Technology;Indian Institute of Management Ahmedabad;University of Wisconsin-Madison;Rensselaer Polytechnic Institute",Stillwater;Ahmedabad;Madison;Troy,United States;India;United States;United States,4,"Roy, Debjit;Krishnamurthy, Ananth;Heragu, Sunderesh S.;Malmborg, Charles",25522771400;7005516128;35560524700;7006047878,60033308;60032179;60160059;60025534,2017-07-01,1 July 2017,Computers and Operations Research,03050548,24355,,Journal,83,,,173-188,"To improve operational flexibility, throughput capacity, and responsiveness in order fulfillment operations, several distribution centers are implementing autonomous vehicle-based storage and retrieval system (AVS/RS) in their high-density storage areas. In such systems, vehicles are self-powered to travel in horizontal directions (x- and y- axes), and use lifts or conveyors for vertical motion (z-axis). In this research, we propose a multi-tier queuing modeling framework for the performance analysis of such vehicle-based warehouse systems. We develop an embedded Markov chain based analysis approach to estimate the first and second moment of inter-departure times from the load-dependent station within a semi-open queuing network. The linking solution approach uses traffic process approximations to analyze the performance of sub-models corresponding to individual tiers (semi-open queues) and the vertical transfer units (open queues). These sub-models are linked to form an integrated queuing network model, which is solved using an iterative algorithm. Performance estimates such as expected transaction cycle times and resource (vehicle and vertical transfer unit) utilization are determined using this algorithm, and can be used to evaluate a variety of design configurations during the conceptualization phase.",AVS/RS | Embedded Markov chains | Integrated queuing model | Linking algorithm | Semi-open queues,32,1,publisherfree2read,Bronze,NSF,CMMI-0848756,National Science Foundation
65,2-s2.0-85030869789,10.5958/0976-5506.2017.00100.0,,,A timeframe study on delay in seeking care during delivery on a group representative of mortality cases,ar,Article,Sengupta D.,119577627;111895573,MGM Medical College;Malda Medical College,Mumbai;Malda,India;India,2,"Sengupta, Debjani;Tapadar, Debajyoti",57213941486;57196004108,111895573;119577627,2017-04-01,April-June 2017,Indian Journal of Public Health Research and Development,09760245,19700188435,09765506,Journal,8,2,,147-151,"Background: There is often a paucity of data on maternal mortality partly due to failure to handle a sensitive issue and partly due to under reporting of maternal mortality Most maternal deaths occur just before, during, or just after delivery, It can be assumed that those obstretics morbidities which require active emergency intervention (operative/ instrumental) are representative of causes of maternal mortality, where lack of timely intervention in the peri delivery period can cause mortality. Further the list of most common indications for intervention coincides with the leading causes of maternal mortality. These mothers who receive active and emergency management at a hospital can be justified to be proxy representative of the unfortunate maternal mortality cases where similar circumstances but dissimilar management caused the catastrophe Thus conducting a study on this proxy representative population can throw light on various factors causing maternal mortality. Objective: Based on the classical 3 delays that model this study was designed to find out the time frame and significant events causing delay in seeking medical attention during delivery on a representative proxy population. Methodology: Study was done for 45 days (1st July-15 August, 2011) days on cases which were decided upon intervention (i.e proxy representative population of maternal mortality) within one hour of admission with a pretested questionnaire administered by investigator Result: 89% were unbooked,. 33% were obstructed labour disorder. 17 cases were referred twice with a total delay of 20.5 hours(transit expense Rs 675), 53 delayed for 13 hours with one referral(transit expense Rs 450) while the last group of 29 delayed 8 hours entirely at home(transit expense Rs 230) 76% received government based health insurance with Rs 100 as transit money. Conclusion: Conclusive findings were large percent of unbooked cases, untrained personels attending the mothers causing delay at initial stage, inadequacy at first level health facility & lack of reimbursement for travelling. Avid campaigning at household level for institutional delivery, proper reimbursement can cut short the delay in seeking health care. Furthermore these study population can be further explored to find out more about the problems of maternal health which require attention.",Maternal mortality | Proxy representatives | Timeframe of delay in care seeking,0,0,,,,undefined,
66,2-s2.0-85009834480,10.1016/j.trd.2016.12.003,S1361920915302649,,Environmental impact and travel time savings of a new monorail system in colombo's commuting traffic,ar,Article,Manoratna D.,60030788;117991576,Hiroshima University;Ministry of Finance and Planning of Sri Lanka,Higashihiroshima;,Japan;Sri Lanka,3,"Manoratna, Dinushi Anupama;Kawata, Keisuke;Yoshida, Yuichiro",57192996596;55215221800;35331125200,117991576;60030788;60030788,2017-03-01,1 March 2017,Transportation Research Part D: Transport and Environment,13619209,20894,,Journal,51,,,122-128,"This study estimates the environmental impact and the value of travel time savings for commuters who travel to Colombo city in traffic congestion when the proposed monorail system is in place. The model considers an introduction of a monorail into a mono-centric city with symmetrically distributed radial highways converging toward the central business district (CBD), with an inelastic commuter demand. We compare the CO2 emission amount as well as aggregate travel time savings from different monorail scenarios, with the introduction of a toll as a necessary condition to generate an efficient outcome. The results show that for a monorail running at an average speed of 40 km/h a length of 26.8 km from the CBD will optimize investment and contribute travel time savings of 105 million Rs. per day or 189 million USD per year to the Sri Lankan economy, resulting in the CO2 emission reduction by 42%. A sensitivity analysis is conducted to evaluate the effects of monorail speed, commuter income, and population growth.",Commuting traffic | Congestion | Greenhouse gas | Monocentric city | Monorail | Value of travel time,13,0,,,JSPS,16H03610,Japan Society for the Promotion of Science
67,2-s2.0-85021253157,10.5937/fmet1704620R,,,"A Multi-objective optimization model for minimizing cost, travel time and CO<inf>2</inf> emission in an AS/RS",ar,Article,Rajković M.,60068815;60004060,University of Belgrade;Univerza v Mariboru,Belgrade;Maribor,Serbia;Slovenia,5,"Rajković, Miloš;Zrnić, Nenad;Kosanić, Nenad;Borovinšek, Matej;Lerher, Tone",7004410919;15758745800;56530856800;13403890700;56055552400,60068815;60068815;60068815;60004060;60004060,2017-01-01,2017,FME Transactions,14512092,21100199778,,Journal,45,4,,620-629,"A multi-objective optimization of automated warehouses is discussed andevaluated in the present paper. Since most of the researchers in materialhandling community had performed optimization of decision variables withsingle objective function only (usually named with minimum travel time,maximum throughput capacity, minimum cost, maximum energy efficiency,etc.), the multi-objective optimization (cost - travel time - CO2 emission/energy efficiency) will be presented. For the optimization of decisionvariables in objective functions, the method with genetic algorithms wasused. To find the Pareto optimal solutions, the NSGA II genetic algorithmwas used. The main objective of our contribution is to determine theperformance of the system according to the multi-objective optimizationtechnique. The results of the proposed model could be useful tool for thewarehouse designer in the early stage of warehouse design.",Automated storage and retrieval systems | Multiobjective optimization | Performance analyses | Warehousing,15,1,repositoryvor,Green,,undefined,
68,2-s2.0-85002926109,10.1371/journal.pone.0166064,,27930659,Bee inspired novel optimization algorithm and mathematical model for effective and efficient route planning in railway system,ar,Article,Leong K.H.,60224275;60029157;60006106,International University of Malaya-Wales;Universiti Malaya;Huaqiao University,Kuala Lumpur;Kuala Lumpur;Quanzhou,Malaysia;Malaysia;China,5,"Leong, Kah Huo;Abdul-Rahman, Hamzah;Wang, Chen;Onn, Chiu Chuen;Loo, Siaw Chuing",57192277730;23484469800;57194026406;35387063500;57192274598,60224275;60224275;60006106;60029157;60029157,2016-12-01,December 2016,PLoS ONE,,10600153309,19326203,Journal,11,12,e0166064,,"Railway and metro transport systems (RS) are becoming one of the popular choices of transportation among people, especially those who live in urban cities. Urbanization and increasing population due to rapid development of economy in many cities are leading to a bigger demand for urban rail transit. Despite being a popular variant of Traveling Salesman Problem (TSP), it appears that the universal formula or techniques to solve the problem are yet to be found. This paper aims to develop an optimization algorithm for optimum route selection to multiple destinations in RS before returning to the starting point. Bee foraging behaviour is examined to generate a reliable algorithm in railway TSP. The algorithm is then verified by comparing the results with the exact solutions in 10 test cases, and a numerical case study is designed to demonstrate the application with large size sample. It is tested to be efficient and effective in railway route planning as the tour can be completed within a certain period of time by using minimal resources. The findings further support the reliability of the algorithm and capability to solve the problems with different complexity. This algorithm can be used as a method to assist business practitioners making better decision in route planning.",,6,1,repositoryam,Green,UM,LL026-16SUS,Universiti Malaya
