,eid,doi,pii,pubmed_id,title,subtype,subtypeDescription,creator,afid,affilname,affiliation_city,affiliation_country,author_count,author_names,author_ids,author_afids,coverDate,coverDisplayDate,publicationName,issn,source_id,eIssn,aggregationType,volume,issueIdentifier,article_number,pageRange,description,authkeywords,citedby_count,openaccess,freetoread,freetoreadLabel,fund_acr,fund_no,fund_sponsor
102,2-s2.0-80053180295,10.1177/0959683611400465,,,Connecting the Atlantic-sector and the north Pacific (Mt Logan) ice core stable isotope records during the Holocene: The role of El Niño,ar,Article,Fisher D.A.,60028897,University of Ottawa,Ottawa,Canada,1,"Fisher, David A.",7403342931,60028897,2011-11-01,November 2011,Holocene,09596836,22634,14770911,Journal,21,7,,1117-1124,"The δ( 18O) Holocene of the Mt Logan ice core is very different from those of eastern Arctic Canada and Greenland. The large changes seen in Logan dwarf even the largest change (the cooling event 8200 years ago) in the Atlantic-sector cores. Large changes in Logan's δ( 18O) and d are related to the state of El Niño as reflected by the Quelccaya δ( 18O) series. It is found that the lagged auto-difference series of the ice core records from the Agassiz ice cap, Greenland and the 23-site stack of paleotemperature records of Kaufmanet al.(Kaufman DS, Schneider DP, McKay NP, Ammann CM, Bradley RS, Briffa KRet al.(2009) Recent warming reverses long-term Arctic cooling. Science 325: 1236) produce highly significant matches to the Mt Logan δ( 18O) series. These correspondences suggest a lag of 1200 years. This lag time is what some models of the Diffusive-Great Ocean Conveyor (D-GOC) predict for the average travel time from the North Atlantic to the tropical eastern Pacific. Monte Carlo testing of the correlations show that they are very significant. The implications of ENSO being affected by the difference between temperatures today and those of 1200 years ago are touched on. © The Author(s) 2011.",Agassiz | El Niño | Great Ocean Conveyor | Greenland | Holocene | ice cores | La Niña | Mt Logan | stable isotopes,11,0,,,,undefined,
103,2-s2.0-80053631036,10.1109/ICAL.2011.6024700,,,Travel time analysis of Stewart-Gough platform in automated storage and retrieval system,cp,Conference Paper,Salah B.,60014264,Universität Duisburg-Essen,Duisburg,Germany,3,"Salah, Bashir;Ramadan, Muawia;Noche, Bernd",52664298700;52664423900;36069687900,60014264;60014264;60014264,2011-10-13,2011,"IEEE International Conference on Automation and Logistics, ICAL",21618151,20000195029,,Conference Proceeding,,,6024700,143-148,"Automated Storage and Retrieval Systems (AS/RS's) are warehousing systems that are used for storage and retrieval of products in both distribution and production environments. This study presents the impact of new design aspects of automated storage/retrieval systems with special emphasis on travel time models. In the aim to find energy saving solutions as well as to improve the efficiency rate of AS/RS's, a new design of AS/RS's has been developed using a parallel wire-based Stewart-Gough platform (parallel wire robot) to serve as storage and retrieval (S/R) machine instead of the conventional S/R machine. This innovated system is named Stewart-Gough Platform based Automated Storage and Retrieval System (SGP-AS/RS's). In this study, the impact of the new AS/RS's design on cycle travel time will be investigated by determining the expected travel time for single command. A numerical case study for the travel time analysis based on mini-load storage and retrieval system has been presented. The results illustrate significant reductions in SGP's travel times in automated warehousing systems in comparison with the conventional S/R machine. © 2011 IEEE.",Automated Storage and Retrieval System (AS/RS) | Cycle Travel Time | Input/Output Point | Single Command | Stewart-Gough Platform (SGP),5,0,,,,undefined,
104,2-s2.0-80053212377,10.1016/j.cie.2011.04.015,S0360835211001161,,Innovative travel time model for dual-shuttle automated storage/retrieval systems,ar,Article,Azzi A.,60000481,Università degli Studi di Padova,Padua,Italy,5,"Azzi, Anna;Battini, Daria;Faccio, Maurizio;Persona, Alessandro;Sgarbossa, Fabio",7102239096;56998697300;13405226400;6602705789;17346547400,60000481;60000481;60000481;60000481;60000481,2011-10-01,October 2011,Computers and Industrial Engineering,03608352,18164,,Journal,61,3,,600-607,"In modern production and distribution systems, the automated storage/retrieval systems (AS/RS), high-storage level systems that reduce labor cost, required floor space and error rate, while increasing product availability, have been widely used since the 1950s. Due to the high-investment costs involved in the development of high-efficient and high-flexible automated storage systems, performance estimation of the systems is both practically and theoretically important. The authors suggest a new method to estimate the travel time of a recently emerging version of AS/RSs, the multi-shuttle systems. The proposal is based on an industrial standard established by the Federation Européenne de la Manutention (F.E.M.). In order to estimate travel times, the authors conduct a Monte Carlo simulation to determine coordinates of two additional representative points which are not given by F.E.M. Then they conduct a new Monte Carlo simulation to compare the results obtained by the method they proposed with those of previous methods and models developed in scientific literature based on Bozer and White formulations. Several real industrial applications demonstrate the validity of proposed method. © 2011 Elsevier Ltd. All rights reserved.",Automated storage/retrieval system | Dual-shuttle | F.E.M standard | Monte Carlo simulation | Travel time estimation,38,0,,,,undefined,
108,2-s2.0-77649337377,10.1016/j.ejor.2010.01.025,S0377221710000330,,Travel time models for automated warehouses with aisle transferring storage and retrieval machine,ar,Article,Lerher T.,60004060,Univerza v Mariboru,Maribor,Slovenia,4,"Lerher, Tone;Potrč, Iztok;Šraml, Matjaž;Tollazzi, Tomaž",56055552400;6603406246;6603388071;14066886400,60004060;60004060;60004060;60004060,2010-09-16,16 September 2010,European Journal of Operational Research,03772217,22489,,Journal,205,3,,571-583,"This paper presents analytical travel time models for the computation of travel time for automated warehouses with the aisle transferring S/R machine (in continuation multi-aisle AS/RS). These models consider the operating characteristics of the storage and retrieval machine such as acceleration and deceleration and the maximum velocity. Assuming uniform distributed storage rack locations and pick aisles and using the probability theory, the expressions of the cumulative distribution functions with which the mean travel time is calculated, have been determined. The computational models enable the calculation of the mean travel time for the single and dual command cycles, from which the performance of multi-aisle AS/RS can be evaluated. A simulation model of multi-aisle AS/RS has been developed to compare the performances of the proposed analytical travel time models. The analyses show that regarding all examined types of multi-aisle AS/RS, the results of proposed analytical travel time models correlate with the results of simulation models of multi-aisle AS/RS. © 2010 Elsevier B.V. All rights reserved.",Analytical modeling | Automated storage and retrieval systems | Logistics | Multi-aisle system | Simulation,60,0,,,,undefined,
109,2-s2.0-77953635178,10.1080/00207540903055693,913662744,,Enhancing performance in order picking processes by dynamic storage systems,ar,Article,Yu M.,60070152,"Rotterdam School of Management, Erasmus University",Rotterdam,Netherlands,2,"Yu, Mengfei;De Koster, René",55475804500;6603607097,60070152;60070152,2010-01-01,January 2010,International Journal of Production Research,00207543,27656,1366588X,Journal,48,16,,4785-4806,"Increasing productivity and reducing labour cost in order picking processes are two major concerns for most warehouse managers. Particularly picker-to-parts order picking methods lead to low productivity as order pickers spend much of their time travelling along the aisles. To enhance order picking process performance, an increasing number of warehouses adopt the concept of dynamic storage where only those products needed for the current order batch are dynamically stored in the pick area, thereby reducing travel time. Other products are stored in a reserve area. We analyse the stability condition for a dynamic storage system with online order arrivals and develop a mathematical model to derive the maximum throughput a DSS can achieve and the minimum number of worker hours needed to obtain this throughput, for order picking systems with a single pick station. We discuss two applications of dynamic storage in order picking systems with multiple pick stations in series. In combination with simulation modelling, we are able to demonstrate that dynamic storage can increase throughput and reduce labour cost significantly. © 2010 Taylor and Francis.",AS/RS | Order picking | Storage | Warehousing,24,0,,,,undefined,
110,2-s2.0-77951138388,10.1080/00207540902796008,910843360,,Travel time models for double-deep automated storage and retrieval systems,ar,Article,Lerher T.,60004060,Univerza v Mariboru,Maribor,Slovenia,4,"Lerher, T.;Sraml, M.;Potrc, I.;Tollazzi, T.",56055552400;6603388071;6603406246;14066886400,60004060;60004060;60004060;60004060,2010-01-01,January 2010,International Journal of Production Research,00207543,27656,1366588X,Journal,48,11,,3151-3172,"In this paper new analytical travel time models for the computation of cycle times for unit-load double-deep automated storage and retrieval systems (in continuation double-deep AS/RS) are presented. The proposed models consider the real operating characteristics of the storage and retrieval machine and the condition of rearranging blocking loads to the nearest free storage location during the retrieval process. With the assumption of the uniform distributed storage rack positions and the probability theory, the expressions of the single and modified dual command cycle have been determined. The proposed models enable the calculation of the mean cycle time for single and dual command cycles, from which the performance of the double-deep AS/RS can be evaluated. A simulation model of the selected double-deep AS/RS has been developed to compare the performances of the proposed analytical travel time models. The numerical analyses show that with regard to the examined type of double-deep AS/RS with a different fill-grade factor, the results of the proposed analytical travel time models correlate with the results of simulation models of double-deep AS/RS. © 2010 Taylor & Francis.",Double-deep AS/RS | Mathematical modelling | Travel time analysis,46,0,,,,undefined,
111,2-s2.0-70449122739,10.1109/COASE.2009.5234102,,,Impact of zones on throughput and cycle times in warehouses with autonomous vehicles,cp,Conference Paper,Roy D.,60146420;60032179;60025534,J.B. Speed School of Engineering;University of Wisconsin-Madison;Rensselaer Polytechnic Institute,Louisville;Madison;Troy,United States;United States;United States,4,"Roy, Debjit;Krishnamurthy, Ananth;Heragu, Sunderesh;Malmborg, Charles",25522771400;7005516128;35560524700;7006047878,60032179;60032179;60146420;60025534,2009-11-12,2009,"2009 IEEE International Conference on Automation Science and Engineering, CASE 2009",,19400157531,,Conference Proceeding,,,5234102,449-454,"Autonomous Vehicle based Storage and Retrieval System (AVS/RS) is a material handling technology, which has been proposed as an alternative to crane-based AS/RS. In AVS/RS, autonomous vehicles provide horizontal movement (x and y axis) within a tier whereas lifts provide vertical movement (z axis) between tiers. The transaction cycle time is composed of waiting time for vehicles and lifts, horizontal and vertical travel times, and load/unload times. In this research, we analyze the influence of multiple load/unload points on transaction cycle times and the design-tradeoffs involved in warehouse zoning. We model the system as a multi-class semiopen queuing network model with class switching and develop a decomposition based approach to evaluate system performance and obtain design insights. We validate the models using detailed simulation. © 2009 IEEE.",,9,0,,,,undefined,
112,2-s2.0-54449094293,10.1016/j.ejor.2008.01.038,S0377221708001598,,A survey of literature on automated storage and retrieval systems,ar,Article,Roodbergen K.J.,60255885;60070152,"School of Business and Economics;Rotterdam School of Management, Erasmus University",Amsterdam;Rotterdam,Netherlands;Netherlands,2,"Roodbergen, Kees Jan;Vis, Iris F.A.",6506018019;6507007157,60070152;60255885,2009-04-16,16 April 2009,European Journal of Operational Research,03772217,22489,,Journal,194,2,,343-362,"Automated Storage and Retrieval Systems (AS/RSs) are warehousing systems that are used for the storage and retrieval of products in both distribution and production environments. This paper provides an overview of literature from the past 30 years. A comprehensive explanation of the current state of the art in AS/RS design is provided for a range of issues such as system configuration, travel time estimation, storage assignment, dwell-point location, and request sequencing. The majority of the reviewed models and solution methods are applicable to static scheduling and design problems only. Requirements for AS/RSs are, however, increasingly of a more dynamic nature for which new models will need to be developed to overcome large computation times and finite planning horizons, and to improve system performance. Several other avenues for future research in the design and control of AS/RSs are also specified. © 2008 Elsevier B.V. All rights reserved.",Automated Storage and Retrieval Systems | Control policies | Logistics | System design | Warehouse,470,0,repositoryam,Green,,undefined,
113,2-s2.0-58249087741,10.1080/07408170802375778,907483331,,Optimal zone boundaries for two-class-based compact three-dimensional automated storage and retrieval systems,ar,Article,Yu Y.,60070152,"Rotterdam School of Management, Erasmus University",Rotterdam,Netherlands,2,"Yu, Yugang;de Koster, Rene",14822788000;6603607097,60070152;60070152,2009-01-20,2009,IIE Transactions (Institute of Industrial Engineers),0740817X,19125,15458830,Journal,41,3,,194-208,"Compact, multi-deep three-dimensional (3D), Automated Storage and Retrieval Systems (AS/RS) are becoming more common, due to new technologies, lower investment costs, time efficiency and compact size. Decision-making research on these systems is still in its infancy. This paper studies a particular compact system with rotating conveyors for the depth movement and a Storage/Retrieval (S/R) machine for the horizontal and vertical movement of unit loads. The optimal storage zone boundaries are determined for this system with two product classes: high- and low-turnover, by minimizing the expected S/R machine travel time. We formulate a mixed-integer non-linear programming model to determine the zone boundaries. A decomposition algorithm and a one-dimensional search scheme are developed to solve the model. The algorithm is complex, but the results are appealing since most of them are in closed-form and easy to apply to optimally layout the 3D AS/RS rack. The results show that the S/R machine travel time is significantly influenced by the zone dimensions, zone sizes and ABC curve skewness (presenting turnover patterns of different products). The presented results are compared with those under random storage and it is shown that significant reductions of the machine travel time are obtainable by using class-based storage.",AS/RS | Class-based storage | Order picking | Storage rack design | Travel time model,77,0,,,,undefined,
114,2-s2.0-77956100868,10.1109/iccie.2009.5223906,,,Bead-sort algorithm for load shuffling in miniload as/rs with an open-rackstructure,cp,Conference Paper,Vasili M.,60103630;60025577,"Islamic Azad University, Isfahan Branch;Universiti Putra Malaysia",Isfahan;Serdang,Iran;Malaysia,6,"Vasili, Mohammadreza;Hong, Tang Sai;Ismail, Napsiah;Sulaiman, Shamsuddin;Voon, Wong Shaw;Vasili, Mehdi",24588202500;8231495000;55606485600;12647225400;52564785900;35147038200,60025577;60025577;60025577;60025577;60025577;60103630,2009-01-01,2009,"2009 International Conference on Computers and Industrial Engineering, CIE 2009",,21100989174,,Conference Proceeding,,,5223906,1781-1786,"Automated storage and retrieval systems (AS/RSs) are a combination ofequipment and control systems which handle, store and retrieve materials withgreat speed and accuracy, under a defined degree of automation. AS/RSs arewarehousing systems that are widely used in distribution and productionenvironments to manage products with cost-effective utilization of time, spaceand equipment. This paper presents an open-rack structure withunidirectional-upward mobile loads within the rack, for miniload AS/RS.Bead-Sort Algorithm and a cellular automaton (CA) are used for defining andsimulating of load shuffling in this AS/RS, respectively. Heuristic models aredeveloped for load shuffling and travel time of the storage platform. A cellularautomaton is a suitable choice for simulating natural physical systems becauseit is massively parallel, self-organizing and is driven by a set of simple,local rules. The Travel time and performance of proposed AS/RS are analyzedusing Monte Carlo simulation and are compared with a conventional one. Theresults show that the open-rack AS/RS represents a higher performance and theproposed models are reliable for the design and analysis of this kind of AS/RS.© 2009 IEEE.",Automated storage and retrieval systems (AS/RS) | Bead-sort algorithm | Cellular automaton (CA) | Loadshuffling | Monte carlo simulation | Open-rack structure,1,0,repositoryam,Green,,undefined,
115,2-s2.0-57049131570,10.1080/00207540701576346,786450156,,Designing an optimal turnover-based storage rack for a 3D compact automated storage and retrieval system,ar,Article,Yu Y.,60070152,"Rotterdam School of Management, Erasmus University",Rotterdam,Netherlands,2,"Yu, Yugang;De Koster, M. B.M.",14822788000;6603607097,60070152;60070152,2009-01-01,January 2009,International Journal of Production Research,00207543,27656,1366588X,Journal,47,6,,1551-1571,"Compact, multi-deep (3D) automated storage and retrieval systems (AS/RS) are becoming increasingly popular for storing products. We study such a system where a storage and retrieval (S/R) machine takes care of movements in the horizontal and vertical directions of the rack, and an orthogonal conveying mechanism takes care of the depth movement. An important question is how to layout such systems under different storage policies to minimize the expected cycle time. We derive the expected single-command cycle time under the full-turnover-based storage policy and propose a model to determine the optimal rack dimensions by minimizing this cycle time. We simplify the model, and analytically determine optimal rack dimensions for any given rack capacity and ABC curve skewness. A significant cycle time reduction can be obtained compared with the random storage policy. We illustrate the findings of the study by applying them in a practical example.",AS/RS | Order picking | Storage rack design | Travel time model | Turnover-based storage | Warehousing,86,0,repositoryam,Green,NWO,undefined,Nederlandse Organisatie voor Wetenschappelijk Onderzoek
120,2-s2.0-36348987866,10.1080/00207540600957795,770289056,,Optimal storage rack design for a 3-dimensional compact AS/RS,ar,Article,De Koster R.B.M.,60070152,"Rotterdam School of Management, Erasmus University",Rotterdam,Netherlands,3,"De Koster, R. B.M.;Le-Duc, T.;Yugang, Y.",6603607097;14629283600;14822788000,60070152;60070152;60070152,2008-03-01,March 2008,International Journal of Production Research,00207543,27656,1366588X,Journal,46,6,,1495-1514,"In this paper, we consider a newly designed compact three-dimensional automated storage and retrieval system (AS/RS). The system consists of an automated crane taking care of the pallets' movements in the horizontal and vertical direction. A gravity or powered conveying mechanism takes care of the pallets' depth movement in the rack. Our research objective is to analyze the system performance and optimally dimension the system. For single-command cycles, the crane's expected retrieval travel time is the same for gravity and powered conveyors; we give a closed-form expression. From the expected travel time, we calculate the optimal ratio between three dimensions that minimizes the travel time for a random storage strategy. In addition, we derive an approximate travel time expression for dual command cycles for the system with powered and gravity conveyors, respectively, and use it to optimize the system dimensions. Finally, we illustrate the findings of the study by a practical example.",AS/RS | Compact storage rack design | Logistics | Order picking | Travel time model | Warehousing,114,0,repositoryam,Green,,undefined,
123,2-s2.0-37849018262,10.1061/40932(246)466,,,Task scheduling and routing optimization for AGVs based on intelligent multi-agent technologies in tobacco AS/RS,cp,Conference Paper,Zhao C.,60031031,Shandong University,Jinan,China,5,"Zhao, Changyou;Zhou, Jun;Liu, Zhanqiang;Li, Jianfeng;Yang, Yun",7403564223;56908576600;24077795900;35300206600;57192547047,60031031;60031031;60031031;60031031;60031031,2007-12-01,2007,"International Conference on Transportation Engineering 2007, ICTE 2007",,9700153105,,Conference Proceeding,,,,2840-2845,"Based on the advantages of multi-agent technology, a method about task scheduling and routing optimization for Automated Guided Vehicles(AGVs) in tobacco automated storage and retrieval system(AS/RS) has been put forward. It is composed of four kinds of agents such as AGVs, scheduling, material manager and traffic controller agents. The strategies for task scheduling and minimum routing optimizing of AGVs have been presented. In QUEST simulation environment, a case model for the logistics system on tobacco raw material storehouse in Jinan General Tobacco Corp.(JGTC) has been researched. Simulation results indicate that this method can improve the efficiencies of storing and retrieving, and reduce the travel length of AGVs in unit time. It also can provide a optimal solving approach in other logistics systems. Copyright ASCE 2007.",AGV | Multi-agents | Routing optimization | Task scheduling,0,0,,,,undefined,
124,2-s2.0-36248984265,10.1117/12.760800,,,Extraction and evaluation of urban agriculture region based on RS and GIS: A case study in Beijing,cp,Conference Paper,Hongbin W.,60023237;112699434,Beijing Normal University;Beijing Engineering Research Center of Protein &amp; Functional Peptides,Beijing;Beijing,China;China,6,"Hongbin, Wang;Huiping, Liu;Junping, Liu;Hua, Liu;Wenli, Huang;Chanjuan, Wang",23004658900;16426085300;23004827400;34872324200;56344635700;23003631200,60023237;60023237;112699434;112699434;60023237;60023237,2007-11-26,2007,Proceedings of SPIE - The International Society for Optical Engineering,0277786X,40067,,Conference Proceeding,6752,PART 2,67522S,,"In this paper, we first review the study of urban agriculture, including concept, connotation, characteristic, function and the region of urban agriculture. Many researches found that urban agriculture is located in urban and peri-urban, but it is difficult to distinguish urban and peri-urban. Some of these researches use criteria influencing the size and shape of the peri-urban area, such as the urban influences, official city boundaries, travel time or distance to the centre, it is no clear. So in our research we extract agricultural land and urban land from Beijing SPOT data by remote sensing technology, calculate the model window the ratio of urban land use, according to the ratio of urban land to determine urban and agricultural areas. We evaluated agricultural development level by using Statistical data, we compare the villages or towns range of higher level of development with remote sensing technology, extract urban agriculture area, and draw the conclusions.",Agricultural development level | Evaluation | Spatial boundary | Urban agriculture,0,0,,,,undefined,
